[
  {
    "id": "VAR.FAMILIARITY.CLAIM",
    "short_name": "F",
    "ontology_type": "STATE_SLOW",
    "entity_type": "HumanAgent",
    "conceptual_module": "MOD.04",
    "label": {
      "en": "Claim familiarity",
      "ro": "Familiaritatea afirmației"
    },
    "definition": "Accessibility/familiarity of a claim for an agent after exposure.",
    "what_it_is_not": "Truth, source reliability, or factual evidence.",
    "range": [
      0,
      1
    ]
  },
  {
    "id": "VAR.CORRECTION.ACCESS",
    "short_name": "C",
    "ontology_type": "STATE_SLOW",
    "entity_type": "HumanAgent",
    "conceptual_module": "MOD.04",
    "label": {
      "en": "Corrective-context accessibility",
      "ro": "Accesibilitatea contextului corectiv"
    },
    "definition": "Current accessibility of corrective information for a claim.",
    "what_it_is_not": "Guaranteed belief correction.",
    "range": [
      0,
      1
    ]
  },
  {
    "id": "VAR.RELIABILITY.ESTIMATE",
    "short_name": "T",
    "ontology_type": "STATE_SLOW",
    "entity_type": "HumanAgent",
    "conceptual_module": "MOD.02",
    "label": {
      "en": "Estimated source reliability",
      "ro": "Fiabilitatea estimată a sursei"
    },
    "definition": "Agent's task-relevant estimate of a source's reliability.",
    "what_it_is_not": "Actual source reliability.",
    "range": [
      0,
      1
    ]
  },
  {
    "id": "VAR.BELIEF.CLAIM",
    "short_name": "B",
    "ontology_type": "STATE_FAST",
    "entity_type": "HumanAgent",
    "conceptual_module": "MOD.02",
    "label": {
      "en": "Belief (claim plausibility)",
      "ro": "Convingere (plauzibilitatea afirmației)"
    },
    "definition": "Latent propensity to judge a claim as true at a given time.",
    "what_it_is_not": "Knowledge, ideology, or identity commitment.",
    "range": [
      0,
      1
    ]
  },
  {
    "id": "VAR.ACCURACY.SALIENCE",
    "short_name": "W",
    "ontology_type": "STATE_FAST",
    "entity_type": "HumanAgent",
    "conceptual_module": "MOD.07",
    "label": {
      "en": "Accuracy salience",
      "ro": "Saliența acurateții"
    },
    "definition": "Contextual decision weight placed on accuracy when acting/sharing.",
    "what_it_is_not": "General rationality or System 2 activation.",
    "range": [
      0,
      1
    ]
  },
  {
    "id": "VAR.EXPOSURE.COUNT",
    "short_name": "Nexp",
    "ontology_type": "EXOGENOUS_INPUT",
    "entity_type": "InformationItem",
    "conceptual_module": "MOD.03",
    "label": {
      "en": "Exposure count",
      "ro": "Numărul de expuneri"
    },
    "definition": "Count or history of exposures of an agent to an information item.",
    "what_it_is_not": "Familiarity itself.",
    "range": [
      0,
      1000000
    ]
  },
  {
    "id": "VAR.ACTION.SHARE",
    "short_name": "Share",
    "ontology_type": "OBSERVABLE",
    "entity_type": "HumanAgent",
    "conceptual_module": "MOD.07",
    "label": {
      "en": "Share action",
      "ro": "Acțiunea de distribuire"
    },
    "definition": "Observed or simulated action indicating whether an item is shared.",
    "what_it_is_not": "Belief or endorsement.",
    "range": [
      0,
      1
    ]
  },
  {
    "id": "VAR.CONTENT.VALENCE",
    "short_name": "Vcontent",
    "ontology_type": "CONTENT_ATTRIBUTE",
    "entity_type": "InformationUnit",
    "conceptual_module": "MOD.16",
    "label": {
      "en": "Information-unit valence",
      "ro": "Valența unității informaționale"
    },
    "definition": "Signed valence assigned to an event-relevant information unit for the M1 reference selection task.",
    "what_it_is_not": "Truth value, factuality, political ideology, or emotional state of a person.",
    "range": [
      -1,
      1
    ]
  },
  {
    "id": "VAR.EDITORIAL.EMPHASIS",
    "short_name": "Eedit",
    "ontology_type": "POLICY",
    "entity_type": "MediaOutlet",
    "conceptual_module": "MOD.16",
    "label": {
      "en": "Editorial emphasis policy",
      "ro": "Politica de accent editorial"
    },
    "definition": "Reference policy controlling which valence-compatible information units are preferentially selected from a fixed event pool.",
    "what_it_is_not": "A measured newsroom bias score, misinformation rate, ownership effect, or platform ranking parameter.",
    "range": [
      -1,
      1
    ]
  },
  {
    "id": "VAR.OBSERVED.SAMPLE.BALANCE",
    "short_name": "Sobs",
    "ontology_type": "DERIVED_METRIC",
    "entity_type": "InformationSample",
    "conceptual_module": "MOD.14",
    "label": {
      "en": "Observed information balance",
      "ro": "Balanța informației observate"
    },
    "definition": "Mean signed valence of the information units actually exposed after editorial selection.",
    "what_it_is_not": "Ground truth, total event valence, or a person's opinion.",
    "range": [
      -1,
      1
    ]
  },
  {
    "id": "VAR.ISSUE.APPRAISAL",
    "short_name": "Aissue",
    "ontology_type": "STATE_FAST",
    "entity_type": "HumanAgent",
    "conceptual_module": "MOD.14",
    "label": {
      "en": "Issue appraisal",
      "ro": "Evaluarea subiectului"
    },
    "definition": "Bounded M1 reference state representing the current evaluation of an event or issue after the observed information sample.",
    "what_it_is_not": "Claim truth belief B, knowledge, ideology, affect diagnosis, or a calibrated population attitude.",
    "range": [
      -1,
      1
    ]
  },
  {
    "id": "VAR.PRESENTATION.FRAME",
    "short_name": "Fpres",
    "ontology_type": "CONTENT_ATTRIBUTE",
    "entity_type": "PresentedMessage",
    "conceptual_module": "MOD.16",
    "label": {
      "en": "Presentation frame",
      "ro": "Cadrul de prezentare"
    },
    "definition": "Reference encoding of a semantically equivalent confirmation versus refutation presentation.",
    "what_it_is_not": "Truth value, factuality, editorial selection, or emotional valence.",
    "range": [
      -1,
      1
    ]
  },
  {
    "id": "VAR.ATTITUDE.CONGRUENCE",
    "short_name": "Gatt",
    "ontology_type": "DERIVED_METRIC",
    "entity_type": "AgentMessageRelation",
    "conceptual_module": "MOD.15",
    "label": {
      "en": "Prior-attitude congruence",
      "ro": "Congruența cu atitudinea anterioară"
    },
    "definition": "Task-specific relation between an agent's prior stance and the semantic stance of the current message.",
    "what_it_is_not": "Stable ideology, party identity, personality, or a global confirmation-bias score.",
    "range": [
      -1,
      1
    ]
  },
  {
    "id": "VAR.ENGAGEMENT.PROBABILITY",
    "short_name": "Pengage",
    "ontology_type": "DERIVED_METRIC",
    "entity_type": "HumanAgent",
    "conceptual_module": "MOD.07",
    "label": {
      "en": "Active-engagement probability",
      "ro": "Probabilitatea de engagement activ"
    },
    "definition": "Latent M1.E2 probability of an active engagement response under the reference presentation task.",
    "what_it_is_not": "M0 Share probability, platform CTR, endorsement, or a calibrated population engagement rate.",
    "range": [
      0,
      1
    ]
  },
  {
    "id": "VAR.ENGAGEMENT.INTENT",
    "short_name": "EngageIntent",
    "ontology_type": "OBSERVABLE",
    "entity_type": "HumanAgent",
    "conceptual_module": "MOD.07",
    "label": {
      "en": "Active-engagement intent",
      "ro": "Intenția de engagement activ"
    },
    "definition": "Reference observable corresponding to an active stated response such as like, share, or comment versus ignore.",
    "what_it_is_not": "M0 Share, observed platform behavior, or endorsement.",
    "range": [
      0,
      1
    ]
  }
]
